TOPIC,topic,topic description ,circle color ,,X story title ,X audio file ,X story description,X link ,X bg color ,x story year,,Y story title ,Y audio file ,Y story description,Y link ,Y bg color ,Y story year,,Z story title ,Z audio file ,Z story description,Z link ,Z bg color ,Z story year,,,,,BG color,current topic circle color
1,politics,"Take a trip down the red, white and blue memory lane. What a difference a decade can make in politics! ",#E3FF99,,Punks for Bush,,"Who says conservatives can't be inclusive? At the 2004 Republican convention in NYC, Youth Radio found some punks with an appreciation for George W. himself.",http://www.npr.org/templates/story/story.php?storyId=3885263,#cce589,2004,,Hope Is The New Rebellion,,"Back in  2008, Senator Barack Obama was a Presidential hopeful running a fresh campaign based on hope. Hear young people at the Democratic National Convention react to that promise.",https://www.npr.org/templates/story/story.php?storyId=94066853,#B4CA79,2008,,Donald Trump Takes Office:,,"In a stunning political upset, Donald J.Trump became President #45 -- with many liberals still asking, “What just happened?”",https://youthradio.org/journalism/podcasts/youth-radio-podcast-donald-trump-takes-office/,#9DB069,2017,,,,,#2E7AAE,#2F344D
2,technology,"MySpace vs. Snapchat, livejournal vs. group text. Listen to find your spot along teen tech culture divides",#AAFF99,,A Video Game Addict Reviews The Sega Dreamcast ,,"It’s a step up from the N64, but will the Sega Dreamcast video game console last the test of time? This gamer review takes you back to simpler times.",NEED TO ADD TO YR.ORG,#9CEA8C,1999,,Public is the new private,,The teen trend in 2008? Moving from email to Facebook wall posts. From the early days of social media receipts.,http://www.npr.org/templates/story/story.php?storyId=93374338,#8ED37E,2008,,Snapchat Sexting?,,An introduction to the then-brand new app Snapchat -- listen to teens reassure adults it’s not ALL about the d**k pics.,https://youthradio.org/journalism/science/how-young-people-are-really-using-snapchat/,#7DBC71,2013,,,,,,
3,fashion,Looking back on the last few generations of teen fashion trends… some things stood the test of time better than others.,#00E0C4,,Lose The Levis,,"“It’s all about that button fly.” And according to one '90s teen, this classic jean brand was simply past its prime.",NEED TO ADD TO YR.ORG,#00E0C4,1999,,Mismatching is the new matching,,"Forget matching your shirt color with your shoe hue. In 2008, it was all about knee-high rainbow socks and candy-colored hair extension. ",https://www.npr.org/templates/story/story.php?storyId=90907618,#00D3BA,2008,,Teens say looks can be liberating despite fashion police,,"Social media isn't the only place teens feel the pressure to look good. The high school hallway is also place where your look can lift you up, or bring you down.",https://youthradio.org/journalism/education/teens-say-looks-can-be-liberating-despite-fashion-police/,#17C0AC,2014,,,,,,
4,slang,"Teens of every generation know: it’s not just what you say, it’s how you say it.
",#B084CC,,Slang Predictions For The Future,,High Schooler Sanovia Jackson rang in 2004 by talking with NPR host Melissa Block what slang phrases were in and out the new year.,http://www.npr.org/templates/text/s.php?sId=1579620&m=1,#B084CC,2004,,The N-word: Slang Or Disrespect?,,"In 2007, NPR asked a bunch of people to weigh in on the n-word -- including this group of Bay Area teens.",http://www.npr.org/templates/story/story.php?storyId=11155621,#A27ABC,2007,,What’s The Meaning Of The Gun Emoji?,,They say a picture can be worth a thousand words. But what happens when that picture is a tiny gun you sometimes use to text your friends?,https://youthradio.org/journalism/education/teens-use-the-gun-emoji-despite-potential-for-misunderstanding/,#946FAB,2015,,,,,,
5,music,"From radio to MTV to YouTube, every generation finds a way to get its groove on. ",#7B6DE6,,Wanna be an MTV VJ?,,MTV was at the height of fashion and music… for the ‘90s. Youth Radio listened in on an MTV VJ audition in 1999.,NEED TO ADD TO YR.ORG,#7B6DE6,1999,,Basketball beef spills into rap world,,"The 2008 NBA finals pitted the Celtics against the Lakers. But off the court, the season's biggest basketball dust-up was between DeShawn Stevenson and LeBron James — and their rap proxies, Soulja Boy and Jay-Z.",https://www.npr.org/templates/story/story.php?storyId=91489009,#7467DB,2006,,Punks Are The New Mall Rats,,"""Meet me at the mall"" isn’t really a thing anymore… unless you’re talking about the punk music scene in Stockton, California.
",http://www.npr.org/2014/08/13/338828404/in-stockton-calif-punks-are-the-new-mall-rats,#6C5FCC,2014,,,,,,